{
  "schema_version": "1.0",
  "report_id": "yu5h1lib-2026-q3",
  "updated_at": "2026-07-21T01:20:00+08:00",
  "tasks": [
    {
      "id": "task-progress-mvp",
      "next_step": "以兩個不同 scope 的範例驗證 schema",
      "decisions": [
        {
          "summary": "第一版採 link-first，不提供檔案選擇器。",
          "reference": "plan.md#已確定的產品方向"
        }
      ],
      "routes": [
        {
          "title": "零建置依賴的靜態 Viewer",
          "state": "selected",
          "reason": "可直接由 Pages 與短期 localhost server 共用。"
        },
        {
          "title": "以可編輯 Kanban 作為核心",
          "state": "rejected",
          "reason": "不符合唯讀報告定位。"
        }
      ],
      "claim": {
        "agent": "Codex",
        "worktree": "TaskProgress",
        "source_paths": [
          "plan.md"
        ]
      }
    }
  ]
}
