{
  "schema_version": "1.0",
  "report_id": "sample-unity-release",
  "updated_at": "2026-07-20T16:00:00Z",
  "tasks": [
    {
      "id": "console-certification",
      "next_step": "Confirm delivery date for the platform test account",
      "blockers": [
        "Platform test account has not been provisioned"
      ],
      "decisions": [
        {
          "summary": "Keep certification work visible as blocked instead of estimating a completion percentage.",
          "reference": ".agents/plan.md#release-validation"
        }
      ]
    }
  ]
}
